{
  "$schema": "https://json-schema.org/draft/2020-12/schema",
  "$id": "https://acelerador.local/schemas/contrato-canonico-aneca-v1.schema.json",
  "title": "Contrato canonico ANECA v1",
  "description": "Contrato canonico de la app para datos ANECA, establecido en MCP_Documentacion.md (bloque B).",
  "type": "object",
  "required": [
    "bloque_1",
    "bloque_2",
    "bloque_3",
    "bloque_4",
    "metadatos_extraccion",
    "archivo_pdf",
    "json_generado",
    "texto_extraido"
  ],
  "properties": {
    "bloque_1": {
      "$ref": "#/$defs/bloque_1"
    },
    "bloque_2": {
      "$ref": "#/$defs/bloque_2"
    },
    "bloque_3": {
      "$ref": "#/$defs/bloque_3"
    },
    "bloque_4": {
      "$ref": "#/$defs/evidencias_array"
    },
    "metadatos_extraccion": {
      "$ref": "#/$defs/metadatos_extraccion"
    },
    "archivo_pdf": {
      "type": "string",
      "minLength": 1
    },
    "json_generado": {
      "type": "string",
      "minLength": 1
    },
    "texto_extraido": {
      "type": "string"
    }
  },
  "additionalProperties": false,
  "$defs": {
    "evidencia": {
      "type": "object",
      "description": "Item de evidencia. El detalle interno varia por bloque y por tipo de merito.",
      "additionalProperties": true
    },
    "evidencias_array": {
      "type": "array",
      "items": {
        "$ref": "#/$defs/evidencia"
      }
    },
    "bloque_1": {
      "type": "object",
      "required": [
        "publicaciones",
        "libros",
        "proyectos",
        "transferencia",
        "tesis_dirigidas",
        "congresos",
        "otros_meritos_investigacion"
      ],
      "properties": {
        "publicaciones": {
          "$ref": "#/$defs/evidencias_array"
        },
        "libros": {
          "$ref": "#/$defs/evidencias_array"
        },
        "proyectos": {
          "$ref": "#/$defs/evidencias_array"
        },
        "transferencia": {
          "$ref": "#/$defs/evidencias_array"
        },
        "tesis_dirigidas": {
          "$ref": "#/$defs/evidencias_array"
        },
        "congresos": {
          "$ref": "#/$defs/evidencias_array"
        },
        "otros_meritos_investigacion": {
          "$ref": "#/$defs/evidencias_array"
        }
      },
      "additionalProperties": false
    },
    "bloque_2": {
      "type": "object",
      "required": [
        "docencia_universitaria",
        "evaluacion_docente",
        "formacion_docente",
        "material_docente"
      ],
      "properties": {
        "docencia_universitaria": {
          "$ref": "#/$defs/evidencias_array"
        },
        "evaluacion_docente": {
          "$ref": "#/$defs/evidencias_array"
        },
        "formacion_docente": {
          "$ref": "#/$defs/evidencias_array"
        },
        "material_docente": {
          "$ref": "#/$defs/evidencias_array"
        }
      },
      "additionalProperties": false
    },
    "bloque_3": {
      "type": "object",
      "required": [
        "formacion_academica",
        "experiencia_profesional"
      ],
      "properties": {
        "formacion_academica": {
          "$ref": "#/$defs/evidencias_array"
        },
        "experiencia_profesional": {
          "$ref": "#/$defs/evidencias_array"
        }
      },
      "additionalProperties": false
    },
    "metadatos_extraccion": {
      "type": "object",
      "required": [
        "comite",
        "subcomite",
        "archivo_pdf",
        "fecha_extraccion",
        "version_esquema",
        "requiere_revision_manual"
      ],
      "properties": {
        "comite": {
          "type": "string",
          "minLength": 1
        },
        "subcomite": {
          "type": [
            "string",
            "null"
          ]
        },
        "archivo_pdf": {
          "type": [
            "string",
            "null"
          ]
        },
        "fecha_extraccion": {
          "type": "string",
          "format": "date-time"
        },
        "version_esquema": {
          "type": "string",
          "minLength": 1
        },
        "requiere_revision_manual": {
          "type": "boolean"
        }
      },
      "additionalProperties": true
    }
  },
  "examples": [
    {
      "bloque_1": {
        "publicaciones": [],
        "libros": [],
        "proyectos": [],
        "transferencia": [],
        "tesis_dirigidas": [],
        "congresos": [],
        "otros_meritos_investigacion": []
      },
      "bloque_2": {
        "docencia_universitaria": [],
        "evaluacion_docente": [],
        "formacion_docente": [],
        "material_docente": []
      },
      "bloque_3": {
        "formacion_academica": [],
        "experiencia_profesional": []
      },
      "bloque_4": [],
      "metadatos_extraccion": {
        "comite": "CSYJ",
        "subcomite": null,
        "archivo_pdf": null,
        "fecha_extraccion": "2026-04-01T20:38:07+02:00",
        "version_esquema": "1.0",
        "requiere_revision_manual": true
      },
      "archivo_pdf": "exp_69cd660f626b5.pdf",
      "json_generado": "exp_69cd660f626b5.json",
      "texto_extraido": "..."
    }
  ]
}
