{
    "bloque_1": {
        "publicaciones": [],
        "libros": [],
        "proyectos": [
            {
                "descripcion": "Calibri : Lorem ipsum dolor sit amet, consectetur adipiscing elit. Nulla lacus arcu, feugiat a ligula",
                "fuente": "texto_extraido",
                "linea": 3
            },
            {
                "descripcion": "dignissim dapibus. Vestibulum ante ipsum primis in faucibus orci luctus et ultrices posuere cubilia",
                "fuente": "texto_extraido",
                "linea": 6
            },
            {
                "descripcion": "nisl non, pellentesque elit. Lorem ipsum dolor sit amet, consectetur adipiscing elit. Morbi arcu nunc,",
                "fuente": "texto_extraido",
                "linea": 8
            },
            {
                "descripcion": "nibh eget rutrum suscipit. Donec in luctus eros. Cras tristique erat a tellus sodales, sit amet",
                "fuente": "texto_extraido",
                "linea": 13
            },
            {
                "descripcion": "commodo, lectus mi hendrerit lectus, nec porta lorem diam eget ipsum. Nulla et est felis.",
                "fuente": "texto_extraido",
                "linea": 16
            },
            {
                "descripcion": "egestas, in vehicula mi eleifend. Integer molestie suscipit justo",
                "fuente": "texto_extraido",
                "linea": 29
            },
            {
                "descripcion": "pellentesque et et lectus. Pellentesque in augue ipsum. Vivamus sapien lorem,",
                "fuente": "texto_extraido",
                "linea": 35
            },
            {
                "descripcion": "sagittis feugiat ac non dolor. Ut adipiscing erat ac tortor fringilla, in lobortis orci",
                "fuente": "texto_extraido",
                "linea": 37
            }
        ],
        "transferencia": [],
        "tesis_dirigidas": [],
        "congresos": [],
        "otros_meritos_investigacion": []
    },
    "bloque_2": {
        "docencia_universitaria": [],
        "evaluacion_docente": [],
        "formacion_docente": [],
        "material_docente": []
    },
    "bloque_3": {
        "formacion_academica": [],
        "experiencia_profesional": []
    },
    "bloque_4": [
        {
            "descripcion": "numero: n",
            "fuente": "pipeline_legacy",
            "confianza": "baja"
        },
        {
            "descripcion": "cursus, feugiat dapibus diam. Cras augue ante, volutpat non velit sit amet, vehicula facilisis lacus.",
            "fuente": "texto_extraido",
            "linea": 4
        },
        {
            "descripcion": "Morbi vitae sapien elementum, gravida felis non, egestas magna. Aenean at mauris vitae magna",
            "fuente": "texto_extraido",
            "linea": 5
        },
        {
            "descripcion": "Curae; Vivamus purus urna, sagittis eget semper id, porta vel risus. Integer sed felis rutrum, tempor",
            "fuente": "texto_extraido",
            "linea": 7
        },
        {
            "descripcion": "cursus a libero eu, bibendum accumsan est. Vivamus non risus pellentesque massa tempus",
            "fuente": "texto_extraido",
            "linea": 9
        },
        {
            "descripcion": "bibendum. Nunc in commodo dui. Integer pharetra felis arcu, id cursus lacus fringilla vel. Vestibulum",
            "fuente": "texto_extraido",
            "linea": 10
        },
        {
            "descripcion": "eget purus consequat, consequat mi ac, feugiat mi.",
            "fuente": "texto_extraido",
            "linea": 11
        }
    ],
    "metadatos_extraccion": {
        "comite": "DESCONOCIDO",
        "subcomite": null,
        "archivo_pdf": "cv_cache_smoke_20260429_073522_7ecd1810.pdf",
        "fecha_extraccion": "2026-04-29T07:35:22+00:00",
        "version_esquema": "1.0",
        "requiere_revision_manual": true,
        "origen_adaptacion": "pipeline_legacy_meritos_scraping",
        "resumen_adaptacion": {
            "lineas_analizadas": 37,
            "lineas_clasificadas": 8,
            "evidencias_generadas": 15,
            "secciones_con_contenido": 2
        }
    },
    "archivo_pdf": "cv_cache_smoke_20260429_073522_7ecd1810.pdf",
    "json_generado": "cv_cache_smoke_20260429_073522_7ecd1810.json",
    "texto_extraido": "Document title \n \nCalibri : Lorem ipsum dolor sit amet, consectetur adipiscing elit. Nulla lacus arcu, feugiat a ligula \ncursus, feugiat dapibus diam. Cras augue ante, volutpat non velit sit amet, vehicula facilisis lacus. \nMorbi vitae sapien elementum, gravida felis non, egestas magna. Aenean at mauris vitae magna \ndignissim dapibus. Vestibulum ante ipsum primis in faucibus orci luctus et ultrices posuere cubilia \nCurae; Vivamus purus urna, sagittis eget semper id, porta vel risus. Integer sed felis rutrum, tempor \nnisl non, pellentesque elit. Lorem ipsum dolor sit amet, consectetur adipiscing elit. Morbi arcu nunc, \ncursus a libero eu, bibendum accumsan est. Vivamus non risus pellentesque massa tempus \nbibendum. Nunc in commodo dui. Integer pharetra felis arcu, id cursus lacus fringilla vel. Vestibulum \neget purus consequat, consequat mi ac, feugiat mi. \nArial : Praesent dictum vel orci ut aliquam. In hac habitasse platea dictumst. Nulla fermentum \nnibh eget rutrum suscipit. Donec in luctus eros. Cras tristique erat a tellus sodales, sit amet \ntempor massa aliquet. Ut a metus vitae ligula viverra congue. Curabitur non feugiat lacus. \nInteger a euismod quam. Donec eu laoreet magna. Fusce semper, lacus in volutpat \ncommodo, lectus mi hendrerit lectus, nec porta lorem diam eget ipsum. Nulla et est felis. \nPellentesque sit amet cursus magna. \nTimes : Curabitur tristique, orci nec consectetur mollis, massa dui semper elit, sit amet pharetra lectus \nurna ut lorem. Praesent id nunc ornare, pretium nibh eget, blandit odio. Aliquam facilisis porta \nsollicitudin. Nunc porta dapibus augue sed pulvinar. Nullam sit amet nisl at urna eleifend scelerisque \neu ac nisl. Integer congue vitae orci vel sollicitudin. Sed aliquet accumsan nunc sed interdum. In non \npurus sit amet risus porta volutpat facilisis sit amet lectus. Suspendisse fermentum purus sit amet lacus \negestas vestibulum. Donec nibh diam, gravida sit amet mi ut, blandit porttitor lorem. Sed non mi vitae \nnulla convallis tristique ac lobortis velit. Mauris sed enim eu nibh porta malesuada. Nullam dapibus \nmauris sed ultricies condimentum. Nulla sodales at leo fringilla aliquet. \nCourier New : Cras iaculis a sapien vel sollicitudi n. Cras bibendum \nin sapien non ultricies. Duis tempus sapien id leo volutpat, sit \namet congue eros mollis. Pellentesque tincidunt pur us a enim \negestas, in vehicula mi eleifend. Integer molestie suscipit justo \nnec auctor. Nam non dolor est. Vestibulum congue he ndrerit ante id \nposuere. \nVerdana : Nullam hendrerit ante sed risus luctus elementum. Morbi consectetur \net diam sed dignissim. Sed a erat metus. Mauris a ultrices velit. Aenean laoreet \nlectus nisi, tincidunt auctor nunc dictum at. Pellentesque at enim ac arcu mattis \npellentesque et et lectus. Pellentesque in augue ipsum. Vivamus sapien lorem, \nsemper auctor ligula sit amet, aliquam imperdiet mi. Maecenas in neque in tellus \nsagittis feugiat ac non dolor. Ut adipiscing erat ac tortor fringilla, in lobortis orci \ngravida. Praesent vulputate neque ac nibh elementum tempor. Etiam tincidunt \naliquam libero, ut faucibus justo sodales sed. Aenean aliquam sodales nulla, vel \nmollis leo blandit at. Morbi vulputate tincidunt venenatis."
}